,review,userName,title,date,developerResponse,isEdited,rating
1015,"I have never had any problems with this Bank, many thanks. W.C.B.Johnson.",willie j 43,BOS,2020-03-04 23:19:20,,False,5
1016,Safe easy way to bank,"&£*""",Banking,2019-09-25 15:58:03,,False,5
1017,"No complaint, v user friendly, use it all the time",Rurigdh,All Good,2018-11-21 12:31:42,,False,5
1018,"The app is easy to use and so helpful due to the hours I work 
👍🏻",Speed7well,Review,2018-08-23 11:20:04,"{'id': 5038228, 'body': ""Hi, thanks for leaving us a review. We're glad to hear you like the app. Simon."", 'modified': '2018-09-13T15:58:05Z'}",False,5
1019,Really easy to use and speedy transactions,elizabethaye,Fast,2018-08-11 12:22:22,"{'id': 5038263, 'body': ""Hi, thanks for leaving us a review. We're glad to hear you like the app. Simon."", 'modified': '2018-09-13T16:00:23Z'}",False,5
1020,Very good service- helpful and easy to use. Thanks!,Beth4308,Straightforward,2018-07-05 06:17:52,,False,5
1021,This app is really handy and well set up,spexxyboy,Good,2021-04-06 09:58:29,,False,5
1022,I can think of many ways of enjoying myself but bank of Scotland is not one of them. Why would you think using a bank is enjoyable?,Wetsnakes,Enjoy bank of Scotland.,2021-11-30 19:36:14,,False,1
1023,"It continues to ask me to register my device, which I have now done 3/4 times in over a month but seems to need it to be constantly reregistered.",steven1872,Annoying,2021-06-17 06:43:00,,False,1
1024,Very good service . Helped me many times . Recommend by myself .,pipypopa,P Hampton,2019-11-19 15:22:11,,False,5
1025,Takes so many attempts to log in it’s frustrating,Calumhalliday,Very slow,2020-12-08 20:29:15,,False,2
1026,I have been trying to download this app for months and it does download but when I go to use it again I have to download it again. What is going on this is pathetic.,Cafcatlover,Why,2020-06-13 15:39:06,"{'id': 16003821, 'body': 'Hello, Thank you for your review. \r\nWe’re sorry to hear you’ve experienced this issue and I’d like to understand more. Please can you send an email to mobileapps@lloydsbanking.com with the subject line ‘darrenappstore’ and I’ll forward this onto the relevant team who can help.\r\nThanks! Darren', 'modified': '2020-06-15T21:59:13Z'}",False,1
1027,By any unknown reason your app is required the authoristion every few weeks Absolutely crap and I will change my bank after nearly 13 years Comparing to Revolut you are way way behind,Just Me No 10,awful app,2019-12-23 07:14:37,,False,1
1028,Best bank very easy phone access,belaid1983leyla,Fantastic app thanks xxx,2019-06-15 08:39:10,,False,5
1029,I have been Banking with BOS for nearly 13 years. It’s always the best.,white245,Always the best.,2019-02-07 21:23:04,,False,5
1030,Easy to use. Helpful service.,PORTIA-PUP,Best Bank,2018-05-30 23:34:59,,False,5
1031,"This app is about par for the course with banks. Completely useless. If there are any errors it will go into unresolvable loops. If there is anything more difficult than the simplest of tasks it will redirect you to a website.
Why are banks so completely crap at technology?",MathCampbell,Utterly clueless,2018-12-11 17:46:37,"{'id': 6371753, 'body': ""Hi, thanks for getting in touch and sorry to hear you're having trouble using the app. Have you tried deleting the app and reinstalling the app and trying the app again? I'll pass on your comments to our teams can take a closer look. Simon."", 'modified': '2018-12-13T14:51:34Z'}",False,1
1032,"App is awful - recent update and it won’t let me log in and access my account. When I have been able to use app, it turns off in the middle of trying to use it",maimac0610,App doesn’t work,2018-10-19 09:46:46,"{'id': 5604079, 'body': ""Hi, thanks for getting in touch and sorry to hear you're having trouble using the app. Have you tried deleting the app and reinstalling the app and trying the app again? I'll pass on your comments to our teams can take a closer look. Simon."", 'modified': '2018-10-22T09:41:47Z'}",False,1
1033,Nice and easy to use,siiuani38,Opinion,2021-02-03 17:26:14,,False,5
1034,Excellent service both in the bank in Fort William and on line.,giveme1000000robux,Ms,2020-12-28 16:37:07,,False,5
1035,"Very good. Easy to use.
Excellent .",bahoomi,Mobile app,2020-09-29 08:00:28,,False,5
1036,App continues to crash since update,Jtm077,Crashing,2020-12-07 12:38:03,,False,3
1037,Well done switched instant thanks,Killerfacerip,Review,2020-09-13 14:44:00,,False,5
1038,Very versatile easy to do all sorts of transactions,Ally1690,Banking App,2020-06-08 05:58:21,,False,5
1039,Easiest banking app to use from what I’ve seen. Bank of Scotland loyal 🙌🏻,NniiccNnaacc,Great,2020-01-16 14:59:47,,False,5
1040,An easy and straightforward facility. Excellent service.,Jim McP.,Online banking,2019-04-29 11:32:39,,False,5
1041,....for winning the race to the bottom of the interest rate charts. Another greedy bank. Don’t give a toss about your customers cutting interest rates yet again. Have had to move all my money out due to uncompetitive rates.,sick of greedy banks,Congratulations to Bank of Scotland,2019-10-02 06:35:15,,False,1
1042,It’s ok but could be better,andy 38 three,Bank app review,2018-11-02 16:01:11,"{'id': 5938783, 'body': ""Hi, thanks for leaving us a review. We're glad to hear you like the app. Simon."", 'modified': '2018-11-14T09:26:40Z'}",False,5
1043,I love how easy it is to use the app,Julzzx,Accounts,2018-08-28 21:17:55,"{'id': 5038214, 'body': ""Hi, thanks for leaving us a review. We're glad to hear you like the app. Simon."", 'modified': '2018-09-13T15:56:53Z'}",False,5
1044,"Brilliant app, very hand to have never had any problems.",Lorlor1980,Great app.,2018-08-10 09:47:01,"{'id': 5038270, 'body': ""Hi, thanks for leaving us a review. We're glad to hear you like the app. Simon."", 'modified': '2018-09-13T16:01:13Z'}",False,5
1045,The app tends to crash frequently and can be difficult to access at times.,Sodden camp,Seems to crash frequently,2018-08-25 14:54:52,"{'id': 5038331, 'body': ""Hi, thanks for taking the time to leave us a review. I'll pass on your comments so our teams can take a closer look. Simon."", 'modified': '2018-09-13T16:09:23Z'}",False,2
1046,"Can’t fault this app it does exactly what I want with the minimal input.
Suits my everyday needs.",B Smiddy,B Smith,2018-07-28 12:16:07,,False,5
1047,Love it so easy to use and quick,Jojoreid,Brilliant app,2018-01-14 14:08:42,"{'id': 2316959, 'body': 'Thanks for the feedback', 'modified': '2018-01-16T14:35:20Z'}",False,5
1048,I’ve tried to log on to my app loads but keeps saying I need to change my passwords changed them even though I knew password then it’s now wanting me to change it again,koomoomeg,Terrible,2018-07-26 15:54:02,,False,1
1049,Great app!,vickymarr1,So quick and easy!,2021-11-16 11:28:45,,False,5
1050,Everything you need in one place,Ilivethebestlife.,Mr Ross,2020-11-05 21:38:40,,False,5
1051,"They need to get their act together as it’s now becoming a joke, it’s now over four days since I was able to log on and no support or anyone to give verbal help.",AndyP52,Losing its credibility,2021-03-23 18:43:42,,False,1
1052,More and more glitches keep appearing. Recently it is taking 2 or 3 attempts to do a money transfer and you cannot do more than 1 at a time.,Elsie W,Keeps crashing,2020-11-15 21:09:47,,False,1
1053,"Love this app for keeping track of my accounts, transfers, direct debits and standing orders.",Suffocated fish,Great app!!,2020-01-15 06:32:59,,False,5
1054,"Since the update keeps crashing, and none of the functionality works",hamerbulkie,Doesn’t work,2020-10-27 11:14:05,,False,1
1055,This has to be the slickest and easiest banking app. Never have an issue with it.,mmh100,BoS banking App,2019-10-23 08:25:47,,False,5
1056,"Been waiting over 3 weeks for a password for online banking  that was to arrive in 5 days  
Tried to get into online banking again and security call failed AGAIN  
Two more passwords are winging their way by post a gain 
In 5 working days 
Pigs will fly 
Meantime I can’t use 
ONLINE BANKING",sondy 19,S murdoch,2019-11-19 15:46:19,,False,4
1057,It is a very easy and effective app. I am relieved that I am using this.,Tahmina Mili,Very easy!,2019-10-11 01:26:16,,False,5
1058,"Very quick & easy online banking, no fuss.",Cogz07,Bank of Banks,2019-06-26 15:02:33,,False,5
1059,Simple and easy to use. Quick and efficient 👍,Kazababe45,Mrs,2019-06-20 12:49:25,,False,5
1060,Very good service easy to send & bank money,yl651179D,T Peebles,2019-02-18 11:58:58,,False,5
1061,Very quick and easy app to use with maximum security! Excellent.,Julesp1005,Bos banking app,2018-10-31 18:08:31,"{'id': 5938780, 'body': ""Hi, thanks for leaving us a review. We're glad to hear you like the app. Simon."", 'modified': '2018-11-14T09:26:35Z'}",False,5
1062,"Easy to use, easy to navigate! Much prefer it to Santander!!",k3lly1223,Best banking app,2018-10-26 08:04:41,"{'id': 5938763, 'body': ""Hi, thanks for leaving us a review. We're glad to hear you like the app. Simon."", 'modified': '2018-11-14T09:26:13Z'}",False,5
1063,So easy to use x,LexiRori04,Transfer money,2018-06-16 15:35:00,,False,5
1064,Love my BOS app it is so quick and easy to use,DavidsonJ,Great App,2022-01-24 21:47:43,,False,5
1065,"I’ve complex pdsd and mental
Health this app has helped me 

And staff thank you 
 Kirsty white",zara1921,Kirsty white,2021-10-30 13:53:48,,False,5
1066,After I enter all details required it always comes up saying my details are incorrect,chrnnzj,Won’t let me create an online banking account,2021-12-01 20:48:52,,False,1
1067,"Pleased always worked goo .d

Thanks",DRMULTANI,Use of app,2021-06-10 19:43:09,,False,5
1068,Love online banking with Bank  Of Scotland. It is so so handy. Many thanks to all the staff at the Alexandria branch.,Bobbys Girl.,Mrs D.,2021-02-27 20:06:52,,False,5
1069,"Now virtually the only way to bank.
Great!",AppleNack,App,2021-01-19 13:22:51,,False,5
1070,Everytime i log in keeps saying “ sorry we are having technical problems “ its been saying it for 2 weeks now what wrong with the app??? !!!!,ShaneLeeFelton,App not working,2021-01-29 10:01:06,,False,1
1071,"Easy to use, clear and concise.",catrindev,Excellent!,2020-11-16 19:53:36,,False,5
1072,As above,holos50,Cheque deposit very useful,2020-05-14 12:31:14,,False,5
1073,"Easy, quick and accurate!",allymacpipes,Awesome App,2019-10-28 16:43:13,,False,5
1074,Best thing ever so convenient thank you bank of Scotland,nudsa,Banking,2019-10-17 17:49:32,,False,5
1075,All the staff at the Bank of Scotland are very helpful and they no what they are doing.,Three pest,Review,2019-09-14 10:20:53,,False,5
1076,This app makes banking so easy,mitchiman71,Simple,2019-09-02 10:46:15,,False,5
1077,Easier than Paypal,kareoke kid,Easier than Paypal,2019-02-04 15:10:54,,False,5
1078,Best bank ever wouldn't use any other,paulzey,Best Bank,2018-12-16 15:18:44,,False,5
1079,Great easy to use !,sen 01,Online banking,2018-10-13 14:38:44,"{'id': 5500850, 'body': ""Hi, thanks for leaving us a review. We're glad to hear you like the app. Simon."", 'modified': '2018-10-15T09:23:10Z'}",False,5
1080,Love being in control!!,Dianet10,Online banking app,2018-08-31 00:44:54,"{'id': 5038197, 'body': ""Hi, thanks for leaving us a review. We're glad to hear you like the app. Simon."", 'modified': '2018-09-13T15:55:31Z'}",False,5
1081,Excellent app which I now use for all my banking,Nugasg,Great app,2017-12-07 12:07:27,"{'id': 1966323, 'body': 'Thanks for the great review!', 'modified': '2017-12-08T09:44:34Z'}",False,5
1082,I really like this banking app. Very easy and straight forward to use for everyday banking.,tennentsT,Great,2017-12-29 07:57:05,,False,4
1083,Easy setup and easy to use,Gaffntg,Ease of use,2021-09-08 12:19:36,,False,5
1084,"Very helpfully staff, I am 73 and forget things occasionally",ourmag86,Helpful      M Marshall,2021-02-03 15:10:10,,False,5
1085,Very easy and straight forward to use,plumber 09,Great App,2019-09-28 16:55:37,,False,5
1086,The Bank should make it Compulsory to Change Password every six months.,Julien-NJo,Mr Njouentchoua JJ,2020-08-21 07:20:09,,False,4
1087,First time I have had online banking😱it’s the best thing ever❤️👏🏻I’m one happy lady😀,BigDeeeeeeee,Miss M,2019-08-06 21:37:40,,False,5
1088,"When I attempt to transfer money from my current account, the account changes to a different one!  Unbelievable!  Why would Bank of Scotland do that?",Finequine,Unbelievable,2019-08-16 05:56:08,,False,1
1089,"Easy to use , A 5 ***** product & service 😀",Mr T4,Great,2019-07-18 10:50:37,,False,5
1090,Very easy & safe to use can do so much with it great product.👍,Shoogles,A1 App.,2018-09-11 16:02:02,"{'id': 5038164, 'body': ""Hi, thanks for leaving us a review. We're glad to hear you like the app. Simon."", 'modified': '2018-09-13T15:53:25Z'}",False,5
1091,Perfect app - easy to use - recommend it,Loubylou65,Brilliant app,2018-04-06 09:01:37,"{'id': 3135086, 'body': 'Thanks for the feedback', 'modified': '2018-04-15T12:53:38Z'}",False,5
1092,I find this app very useful and easy,Er214,Very useful,2018-03-19 21:28:59,"{'id': 2904588, 'body': 'Thanks for the feedback', 'modified': '2018-03-22T21:05:31Z'}",False,5
1093,"Great banking app and it works like a charm whenever I use it! 
Well done! ⭐️⭐️⭐️⭐️⭐️",Brandyandcoke,Brilliant banking app,2017-10-24 22:36:31,,False,5
1094,Best banking app I’ve used and a great bank,Tambo13,Banking app,2021-11-04 15:42:09,,False,5
1095,Really easy to use very helpful app,offthehookhairdesign,Great app,2021-03-20 11:25:59,,False,5
1096,Easy to use safe appt,lothlorien01,Easy to use,2020-09-25 09:54:16,,False,5
1097,So easy to use and security is second to none,gonsalez 1999,Mrs W,2019-06-13 08:09:36,,False,5
1098,"Every single time you update this app, it kicks me out and and unregistered my finger print. I can’t remember information that well and keep having to go through security processes to reset.",mrdeaconwoodside,Details,2019-08-16 07:33:37,,False,1
1099,"Stop asking irritating questions when I am trying to bank !
When I do feedback you dont listen 
So dont believe this matters to you at all 
So stop asking me what I think then ignoring what I think",vintageoldgrumpy,Annoying surveys,2019-07-03 15:20:05,"{'id': 10069173, 'body': ""Hey there. We're really sorry to hear that you feel we're ignoring what you're saying. I can guarantee we definitely are reading every single piece of feedback left in those the surveys, and driving the conversations to help get what our customers want, prioritised. The app store, our mailbox and those surveys are hugely important to us as it is through those channels, we know what you want delivered and what areas/features need more attention. Thank you for your patience! Ankit"", 'modified': '2019-08-08T08:59:55Z'}",False,1
1100,Once set up very easy and handy to use Love it,ritapakora,App,2019-03-04 14:51:46,"{'id': 7694958, 'body': 'Thanks for the review!', 'modified': '2019-03-12T15:31:57Z'}",False,5
1101,User friendly. Rapid transfers. Would recommend.,Jamesybershty,Great App,2018-08-05 13:00:36,,False,5
1102,"Intuitive user experience, simple interface and secure.",Snowdog007,Best banking app by far,2018-10-15 06:42:50,"{'id': 5558481, 'body': ""Hi, thanks for leaving us a review. We're glad to hear you like the app. Simon."", 'modified': '2018-10-18T11:00:07Z'}",False,4
1103,Far superior to the royal bank!,Keef da beef,Keith,2021-05-24 15:09:43,,False,5
1104,"Does what I need it to do - good app, no problems whatsoever in comparison to previous versions",Stewartie Mac,Excellent update,2018-01-30 21:27:31,"{'id': 2455937, 'body': 'Thanks for the great feedback', 'modified': '2018-01-31T10:24:48Z'}",False,4
1105,Well done for efficiency .,chrissyemm,Great Service,2020-08-05 15:41:27,,False,5
1106,Ease of use 10 out of 10,The fore man.,Great app.,2020-04-15 22:43:56,,False,5
1107,"This app does not allow a jailbroken device to use their app could they state the reason why, what is actually wrong with jailbreaking absolutely nothing!",Christopher Philps,Stop Blocking Jailbroken phones,2020-05-13 13:21:17,,False,1
1108,Very easy to use and reliable app.,Jasperktm,Easy!,2019-03-04 13:27:17,"{'id': 7694959, 'body': 'Thanks for the review!', 'modified': '2019-03-12T15:32:03Z'}",False,5
1109,Quite often you can’t get logged in.,Teadarling,Temperamental access,2019-11-27 22:03:24,,False,3
1110,"The new update on this app is very poor the previous version was a much better option 
Disappointed with this and unlikely to be using it",Pioneer3621,Update poor,2019-08-24 22:38:56,,False,1
1111,"So useful!
Works really well👍",1grumph,Very user friendly App.,2018-11-19 11:08:57,,False,5
1112,A great app for non tech savvy people like my self.,Ifty 1,Simple secure and convenient,2018-06-22 22:16:47,,False,5
1113,It makes life so easy with Internet banking I love it,Eddon35,Love the app,2017-10-17 02:10:12,,False,5
1114,It’s a very easy app to negotiate. Very simple,Otchen82,Simple,2021-06-18 17:20:12,,False,5
1115,So handy and easy to use.,jill05719./,Bank of Scotland app,2019-02-16 10:56:38,,False,5
1116,The cheque imaging tool is very poor and doesn’t work most of the time.,Shaid M,Cheque Imaging poor,2020-10-28 09:30:18,,False,3
1117,Self explanatory above,aaaasawà,Great App but lacking of customer rewards,2018-10-04 09:49:51,"{'id': 5402572, 'body': ""Hi, thanks for leaving us a review. We're glad to hear you like the app. We are always looking at ways to improve the App and your feedback is appreciated. Simon"", 'modified': '2018-10-08T10:54:26Z'}",False,5
1118,Does the job perfectly,DeeDeeDee21212,Great,2017-09-15 20:04:41,,False,5
1119,"I want to see my balance or send a payment, stop showing me ads to different products you offer.",ISIS=ISRAELsecret IntelService,Stop pushing ads,2022-01-06 09:26:44,,False,1
1120,Excellent service,Chip@22,Thanks,2021-08-26 16:40:03,,False,5
1121,A brilliant app greatly improved over the years!,Sol 7,BOS App,2019-06-15 11:58:09,,False,5
1122,Can’t open app at least 50% of time since last update.  Been weeks now.,bigmckay,Log in problems,2020-10-24 21:59:40,,False,1
1123,Online banking is so easy to do and keeps check on finances,gilschy 5,Claire,2019-10-26 10:47:27,,False,4
1124,Simple and secure app... that is all I need and this is exactly what this app delivers. :-),oldmanlawlor,Simple,2017-11-24 07:27:52,"{'id': 1854733, 'body': 'Thanks for the great feedback!', 'modified': '2017-11-27T08:51:02Z'}",False,5
1125,"Fab App. Can do everything I need, and a doddle to use. Great layout.",SirFin,Brilliant,2017-09-02 10:59:18,,False,5
1126,Is a fab thing to have. Especially in this crisis. Thank you BOS,HOOPY HUDDLE HOUMD,John Hughes,2020-05-29 06:55:42,,False,5
1127,Thanks to the branch staff and a great and easy online offering,BlueBobby1972,Feedback,2021-11-15 23:52:19,,False,4
1128,Banking at any time! Wonderful,Ruchhill,Convenience,2019-12-07 00:13:59,,False,5
1129,"Been terrible, app keeps crashing, so much hassle having to delete and then download again",kath@6827,Mobile App,2020-04-15 00:55:40,,False,1
1130,"Easy to use and great on the go 
I use every day",Kev 1983,Best app,2019-10-13 08:16:29,,False,5
1131,Very fast and easy to use,babylonlion,Fast & easy,2018-10-25 16:27:00,"{'id': 5674398, 'body': ""Hi, thanks for leaving us a review. We're glad to hear you like the app. Simon."", 'modified': '2018-10-26T14:50:44Z'}",False,5
1132,Have banked with Bank of Scotland for over forty years. What has my loyalty got me? You’ve taken a derisory ISA rate of 0.35% and REDUCED it to a pitiful 0.2% Clearly you have no need for my hard earned cash so it will be going somewhere it’s more appreciated.,unappreciated12345,Interest rates,2019-07-12 07:33:59,,False,1
1133,Best bank ever!! Left TSB as they are shocking! I can even scan cheques on this app!,gajdhsyywv,Perfect,2018-06-27 16:32:14,,False,5
1134,I’d be lost without this app great no issues at all,Caggie 659,Great app,2017-12-19 10:27:38,,False,5
1135,Does all u need to do with online banking,robb1212,Great app,2017-08-17 09:44:10,,False,5
1136,"Love my app saves so much time 
Well secured",marydoll1952,BoS app,2021-11-10 20:10:21,,False,5
1137,Fantastic s,ICW-Nicky,Amazing service,2021-07-14 15:05:08,,False,5
1138,New logout screen shows personal details which I am not happy with.,Rob44H,New login screen.,2021-11-04 18:05:20,,False,2
1139,"Been locking my account now for 7yrs every 2nd month when I go to work abroad
Was told it’s my fault for working in the desert.
Soon to close all my accounts with BOS",Hannolly,Online banking,2021-09-27 19:24:12,,False,1
1140,Does exactly as it should - well done BOS,yyytttrrrecc,Perfect App,2021-02-08 22:58:39,,False,5
1141,So easy and quick to use,jackie paterson,Mrs Paterson,2020-12-30 07:24:46,,False,5
1142,"Very happy today, thanks",tiny6footer,Good service,2021-01-26 17:25:51,,False,4
1143,Reliable and fast.,Johnman27382937,Good app,2020-11-10 18:21:51,,False,5
1144,Great bank app. So simple and easy to use.,Carol from Glasgow,BOS app,2020-10-13 16:37:13,,False,5
1145,Great easy to use app. Ideal for managing money on the go.,Carringtonsmythe,Bank of Scotland app,2018-12-28 16:47:34,,False,5
1146,"Great and easy to use anywhere, anytime. Perfect. Thanks",alzab,Excellent,2020-10-01 16:52:39,,False,4
1147,"Latest update seems to have removed Mobile Cheque deposit. This was very useful and a great time saver. Why has it been removed?

Tried to reinstall. Still no Mobile Cheque. I can’t even review previous Mobile Cheque deposits, though I can see them as deposits!

Your app information clearly states Mobile Cheque. (deposit a Cheque) as a feature of the app - it isn’t. 

Malcolm",msmuir,Mobile Cheque gone,2019-03-17 23:52:51,"{'id': 7781448, 'body': 'Hello, the cheque deposit feature was temporarily down yesterday. It is back in the app now. Apologies for the inconvenience caused.', 'modified': '2019-03-18T09:46:37Z'}",False,1
1148,I am very happy to use this app,kmanat,Very good app and service,2018-08-16 09:46:49,"{'id': 5038240, 'body': ""Hi, thanks for leaving us a review. We're glad to hear you like the app. Simon."", 'modified': '2018-09-13T15:58:57Z'}",False,5
1149,Best app on my phone ever,Patsy's 1,5 star,2021-01-24 18:29:52,,False,5
1150,"Functionality is great, but why in the recent update has the design and usability gone backwards?!",Banking app user 3,Recent UX/design update shocking,2018-05-13 09:19:56,"{'id': 3457023, 'body': ""Hi, sorry to hear you're not liking the new updated version of the app. We're planning other interface changes which will land later in the year so keep an eye out. I'll ensure these comments are recorded. Anthony."", 'modified': '2018-05-14T09:50:56Z'}",False,3
1151,"Not a bad app, but doesn't update quickly when Apple update.",Ap22222,Doesn't update to apple IOS,2017-09-05 17:41:04,,False,3
1152,Weekly IT issues! Time to move to a provider whom can manage there IT platform,Jwilson76,Worst bank for IT issues,2021-07-19 11:15:19,"{'id': 24091852, 'body': ""I'm really sorry to hear you're having trouble logging on to our app. We're aware of an issue impacting some customers and are working to fix this. In the meantime, deleting and re-installing the app on your device should resolve the problem. ~ Emma"", 'modified': '2021-07-23T12:23:30Z'}",False,1
1153,I am not able to use app on Wi-Fi. It works on wired connection or phone’s data.,Saughs,App problem,2021-05-01 15:53:01,,False,2
1154,Non existent been a customer over 50 years service all time low tried to send but won’t accept name  need I say more !!!!,its no funny,Service,2021-03-01 14:15:12,,False,1
1155,Banking is relatively easy with yourselves,garyballoch,Bank of Scotland,2020-11-17 19:48:10,,False,5
1156,Often experiences technical issues so I’m unable to check my account or carry out actions. Very frustrating.,Andrew Foxton,Bank of Scotland app,2021-01-12 08:36:47,,False,1
1157,Great app to use,Ross1234567,Easy to use,2020-11-05 21:10:05,,False,5
1158,"Great app, straight forward.",Galzy12003,Helpful,2020-02-27 20:14:52,,False,5
1159,Does what it says it’s supposed to.  Liking the new design.,ajdroo92,Good App,2020-01-19 18:42:03,,False,5
1160,Easy to use and convenient.,flower lassie,Great App.,2019-11-02 13:46:09,,False,5
1161,Just like magic money moved everybody happy,piperboo88,Thanks,2019-11-28 20:33:54,,False,4
1162,Stop interrupting my transactions by asking me to rate you in the middle of paying for things . It’s very disruptive.,westwatcher,Stop interrupting,2019-11-21 21:41:34,,False,3
1163,Love this app,nikm1970,Great app don’t know what i done without it,2019-10-11 11:03:58,,False,5
1164,Excellent service,Bluebell Maggie,Bank of Scotland,2018-08-30 08:57:18,"{'id': 5038201, 'body': ""Hi, thanks for leaving us a review. We're glad to hear you like the app. Simon."", 'modified': '2018-09-13T15:55:41Z'}",False,5
1165,"I have lost total respect from the unreciprocated customer loyalty  for lloyds group

And with no credit card or viable interest options   BoS “private” bank   Nothing polite is remotely possible",Frust-0-rated,Lloyds group “by your side”  yup with o.2%gross thieving hands in customers pockets,2018-11-08 18:27:12,,False,1
1166,Very clear and functional.,bangface,Excellent app,2017-12-29 08:58:05,,False,5
1167,"Opened a basic bank account(all they would give me) on my return from being in Canada for 5 years. No contactless card, can’t use at petrol stations which are not maned. Absolute joke",Scotland1234567890,Crap,2018-08-25 07:11:54,,False,1
