,review,userName,title,date,developerResponse,isEdited,rating
1534,"Very easy to use, I live a long drive from any banks so I use this for everything! The only thing that could be annoying is that when you put in the three digits (memorable info?) to open your accounts it doesn't give you a chance to confirm it, so if you put the last digit in wrong by mistake, that's you wasted 1 out of 3 try's to access your accounts. 
Anyway I love the app!",Calmac ,Brilliant,2014-12-04 11:04:04,,False,5
1535,"Really good,simple banking app. Use it all of the time as living rurally I have no choice as all our branches are closing or on restricted hours. App is great but in the past few months it has a habit of login out as soon as you try to open it. Really annoying as sometimes it keeps on doing it for several attempts before finally login on.  Apart from that I love it.",peem1,Great app when it loads,2016-05-27 07:26:31,,False,5
1536,"This app used to be riddled with bugs, but the dev team have really listened to customer feedback and resolved every issue that existed.

It's a brilliant app that does what it should. I love the fact you don't need to go to the next space like the Santander app, when you input a digit it automatically moves to the next box for you to input the digit there and so on... That's the #1 feature to me!",Darren Henry,Amazing,2016-02-09 14:17:55,,False,5
1537,"I used to use have a widows phone & the BOS app for windows was terrible, but this one is way better. Better access better layout & so much easier to use plus I can use all the app has to offer, not just the basic stuff, so all in all I'm glad I upgraded my phone it's made keeping track of my account less annoying.",HalfPint1319,Improvement,2017-04-27 09:36:25,,False,5
1538,"This app makes banking so simple, which is what it is designed to do. If you need to do more, like close an account, set-up a new payment, you simply just need to log in to internet banking via the internet browser on your phone instead. I feel very annoyed by the negative reviews on here as they are mainly unjust. It is so easy, and still extremely secure. I am very happy.",Katie3737,Great app,2014-03-29 08:25:02,,False,5
1539,What I don't think anyone appreciates until they've set it up is you're logging on with just your memorable information so really quick and once completed security to authorise your phone and it means no more calls to send a payment. More functionality will come with time and until then there's the desktop. Be patient,Doobie85,It's works just fine,2014-03-29 06:19:11,,False,5
1540,"Seriously? It was fast, it was easy, it was very convenient so the point of the update was...,..???  I'm assuming app designer guy does this for a living or did you just give the job to some poor work experience kid.  Obviously the former as the latter would undoubtably have done a better job.  One star A: because no stars isn't an option and B: ok you got the logo on the app badge. Well done you x",Fair scunnert,"If it ain't broke....,,",2014-06-20 22:47:10,,False,5
1541,"Reading the other reviews I thought this was going to be rubbish, but I'm not having any issues with the app so far. It's really solid and there is a link to the desktop site for some of the bits you can't do in the app like managing standing orders and direct debits.

Shame others are having bother with it but for me it's fine.",Pimptovimto,No issues for me,2012-03-23 06:56:44,,False,5
1542,"This is a major step up from the previous app. The combination of security (device recognition) and convenience (short password) make it a painless experience - unlike the previous iteration. 

In app is very clear typography and the navigation makes sense after you've had a play. It could develop a little more, and there have been a couple of bugs, but overall I enjoy using the app.",mikewalker19,Fantastic user experience,2014-03-04 17:45:03,,False,4
1543,"Functional app but an issue about real time balance updates - the transactions reflect changes but not the stated balance.  This may need to addressed in any future updates.
Disappointed to add that the balances do not reflect any transactions after completion, even if these are internal transfers.  In order to obtain the updated and correct balance you have to sign out and then sign back in.",Ariyatil,Ari-ya-til,2015-09-10 07:06:04,,False,5
1544,"My only gripe about this app is a very small one, within the ""Pay an Account""option other BOS accounts are listed without names, only the account numbers.
This can make things slightly confusing. Perhaps if they had the names of the account holders. Other than that, this app is everything needed in a banking app.
Thank you.",crew_kid,Almost the perfect app.,2015-03-25 08:36:55,,False,5
1545,"Much better than the initial app. However recent updates have broken the app. I run iOS 8.1 but the app not loading the login page until the phone restarted, which is a pain. Also I have number of payees setup and I can't scroll down to get to the bottom few payees. Recent updates have killed the joy of using the app.",Dhammika S,Need more work,2014-10-30 08:36:32,,False,5
1546,"I have BOS app on iPhone & Halifax on iPad & they are excellent!! Does everything no need to phone/go branch. Never had any problems been using Online 10yrs+ and app 4yrs, constantly being improved you can cancel & order lost/broken card, move money, set up/cancel standing orders/DD, Apply for other accounts and all sorts.  It's also very secure.",LadymUK,Best app compared to other banks I use,2016-06-30 09:57:10,,False,5
1547,With my recent purchase of the new iPhone 6 plus I realised I would have to wait a bit before most of my apps would be updated but after 2 months of the phone being out I think it's time I start asking. I really like the app but the resolution is putting me off. In the next update I would really like if you could add the option of using Touch ID for accessing your account instead of the way that is currently being used. Thanks,Eufez,App need updated,2014-12-13 22:44:23,,False,3
1548,This app is perfect if you are a very busy person! It takes seconds to use and sort your finances! I do miss the texts if you are close to Your limit not that it happens often! Just when your busy you may forget to check your account! I also can't fault Bank of Scotland! Great bank and friendly service.,Mum7707,Busy mum/nan and full time worker,2014-08-15 08:22:32,,False,5
1549,Fantastic app constantly keeps me up to date with my spending and so on. Great to always keep checking when using your card to buy things as I've went over my allowance a few times as some shops give u a floor balance so u think you have got money left in your account but actually already spent it so it's been a great help to me!!!,Dodiebhoy,Bos,2015-09-20 23:28:03,,False,5
1550,"A terrible excuse for an app - nothing more than a shoehorned portal to the mobile web site and even that doesn't offer full control of things like payments and standing orders etc. other banks do this much better - a pin protected interface to bypass the long and clumsy log in sequence would have redeemed this but hasn't been included. 

Just bookmark the mobile site in safari and save yourself the space on your homescreen. A very lazy effort at having an App.",Monolithika,Waste of space,2012-01-01 15:02:49,,False,3
1551,"Brilliant App! Don't even think about it, download this app immediately. It's easier than just signing in the normal way. We have so many passwords to remember nowadays. I forget mine a lot. So therefore I've lost count of all my different passwords. The fingerprint access is perfect for me. But the app too is brilliant. Don't delay download this app & I promise you won't be disappointed.",MizziFB,Fab App!!,2016-10-26 12:35:21,,False,5
1552,Vast improvement on previous app. I'm a busy dad to two students which essentially means transferring the contents of my accounts to theirs. This app allows you to keep on top of balances of your own accounts and making payments and transfers is very slick and quick- I now rarely use my laptop for day- day transactions,Itsiainhere,Great for keeping on top of accounts,2014-09-27 09:31:46,,False,5
1553,"Unlike a lot of the reviews I use this app all the time, anywhere, with no problems!

You can instantly transfer money between your accounts and keep an eye on your balance - next step would be notifications of low balances/ nearing overdraft limit etc...",Bhoihv,"Does everything, quick and mobile!",2012-06-16 16:25:13,,False,5
1554,"Really enjoy using this app however every single day at one point or another it won't let me log in because it says ""sorry we are experiencing technical problems. Please try again later."" Now I don't know if this is the app or the BoS servers but it's pretty annoying as it does happen very often.",Jamiesan,Technical Problems,2016-09-27 08:02:51,,False,5
1555,It's so useful to be able to check your current balance directly after you've bought something as well as keeping a track of what you have bought. Couldn't live with this as its so easy to transfer money to and from and contacts and between accounts!,E Hewitt,Life saver,2016-04-30 15:38:59,,False,5
1556,App looks great but still has bugs transactions are messed up from the 5th of Feb jumps back to the 7th and from the 3rd of feb back to 5th the sums are inconsistent with the with the totals after the transactions have been registered. Looks great but does the job like a prototype. Hope you get a hotfix for it coming soon.  It's a money utilising app from a respectable bank not Fruit Ninja.,Silver typhoon,Bug,2015-01-10 11:08:03,,False,5
1557,I love this app 😀. I does exactly what is says on the tin.  It's easy to use and I use it daily. No more trips to the bank to move money.  I also like the fingerprint option instead of putting in the password stuff. One downside is the mobile app is slightly restricted in that I can removed contacts from my payment list.,Sandishaw,It's a banker,2016-10-07 08:09:25,,False,5
1558,"Good improvements but I'm always sceptical of what happens to my transfer delays. E.g.'s 1 - pay off credit card, money leaves my account instantly, but clears my CC balance 2 or 3 days later. 2 - monthly loan payment leaves my account but again doesn't come off my loan amount balance for 2 or 3 days.  Multiply this by a few million customers and you have significant amounts of money in  'the ether'!",ArnieMaclean,Constantly improving,2016-12-30 20:58:53,,False,4
1559,"Not a bad effort from BOS, however seems rushed to market.

Error messages remain partially on the screen when closed, statements and transactions show, swipe to a new account and return and you are told that there are no transactions to view. App restart only way to get them back!

Account type names are missing display letters, still unable to view certain account types without going to the desktop version.",BobbyT1305,"Good, but a few bugs",2014-01-16 21:42:07,,False,3
1560,"This ap is so useful, can access your bank account easily and carry out all sorts of transactions while away from home. It means you can always get up to date information and they even text you when your near your limit to avoid bank charges. Don't know how I managed before",Emeraldgreen13,Very useful,2015-12-31 10:41:50,,False,5
1561,"Very useful app for when I need to check my balance, move money around my accounts and transfer money to other people. Was a godsend while on my year exchange in Argentina to still be able to not only access my account in Scotland, but do almost anything I can do in the bank or online.",Edu1102,Very useful app,2015-09-29 23:57:54,,False,5
1562,"Brilliant app... I can't really find any fault with it at all. Intuitive and simple to use BOS have designed a complete wrap around service for customers to manage their money on the go. I can't imagine going back to use laptop or even telephone banking, this app is a must for all customers!!",Slinky_4,Fast and convenient way to manage your money,2015-06-25 14:30:57,,False,5
1563,"So far, so good - much better than the old app and I love that you do not have to go through the tedious log on that the previous app had. Have been waiting a while for this kind of update! Only comment would be that I would prefer a 'pin' number of sorts rather than memorable data to log in.",Dee*S*,"Soooo much better, at last!",2014-01-28 18:10:28,,False,5
1564,"This app is ok, it gives you quite useful, standard information and at least you can read it (unlike when you use the desktop site on your phone).  Hopefully it will have more functionality as it gets updated over time but it's progress at least.",Tamothy,Does the basics,2012-01-01 11:27:46,,False,5
1565,"This 'app' was long overdue but the wait certainly was not worth it.  
It offers no more than the mobile web page and is limited in its functionality by not allowing full account control. 
The login process is just as convoluted as the BOS web page and does not make for an easy process that you would normally associate with an app. Overall, it just seems to have evolved purely to have a presence on the app store rather than be a fully thought out 
app like some others that are available.",AmbuTech,A lazy excuse for an app.,2012-01-05 10:15:19,,False,1
1566,"So easy to use and handle. I ve not had a problem with it. Only suggestion I would say is to have access to change details if I am abroad because I was in China for a year and the Internet was atrocious and it would have helped if I could have used the app more then. 

Otherwise IS PERFECT!",Stefania93,Easy accessible and fantastic,2015-09-07 20:40:50,,False,5
1567,"Pleased to see and actual app now for bank of Scotland as apposed to just a link to the mobile banking website. 

4 stars because I like the interface and how quick it is for me to log in using my memorable phrase. 

1 star off the 5 because it lacks the ability to pay my 'payee's'. I.e pay my bill like I can on the digital banking website.",Colin Crawford,Vast improvement in this new version,2014-01-23 23:28:15,,False,4
1568,"If asked what improvements I would like to make to this banking app. The answer is ""nothing"". Does everything that you need I a simple and user friendly manner.  Access all of the important information that you need. Even better to use than the desktop browser version.",Willie Watt,Perfect,2015-07-21 11:44:24,,False,5
1569,"I work for the Royal Bank of Scotland and I bank with the Bank of Scotland. I love the Bank of Scotland and I LOVED the app. The update is horrible, it almost seems childish and the UI is cluttered and doesn't look sleek anymore. I understand there will no doubt be updates in the near future per reviews but I really really really don't like the new app at all",SheHasDoneItAgain,Not happy,2016-11-17 20:35:12,,False,5
1570,This app is a fantastic benefit to me as I can do all my business online . I have mobility problems and it saves me time and great effort trying to get to the bank . I sometimes wonder how I managed without it . It's so easy to keep an eye on my purchases and I can also pay any bills that I have . Would recommend it,Elkie5629,Bank of scotland,2014-02-27 20:25:48,,False,5
1571,New update is fantastic.   Some people moaning about the UI I think new style is lovely and personally it's down to personal choice and you can please every one.    The actual app colours and style aside is fantastic. The best banking app I have used and I have used a lot.  Love Bank of Scotland. Would never change well done,waynedavey,Fantastic banking app,2016-11-23 15:35:23,,False,5
1572,"Use this app daily, it's great. Crashes from time to time which can be irritating when I really need it, especially as the website isn't great on mobile. Touch ID would really just make it better though I do like the fact it's only 3 touches to get into, so can't complain really!",Hc19,So easy - could use Touch ID,2016-03-09 19:28:27,,False,5
1573,"I like the ease of use and quick log in. However, since the last update, when I log out but then try to return again, the page doesn't load properly. It's a shame because it's the best banking app I use.",Rosfk,Like the functionality but last update crashes,2014-11-25 15:04:24,,False,5
1574,This app is great! The only problem I have with it is since iOS 8 came out sometimes my screen goes black and can't log in need to double click home button to close app then usually works after that when I try log in. Still great but want this problem fixed.,J owns,Great app,2014-10-31 05:46:36,,False,5
1575,This is poor service updated app over a week ago and when I click on it since then it just flashes up and goes off.. Used to use it everyday and any other service would have had thus sorted within days... Over a week on and still unable to use it,Hddhhdh,Debansco,2012-09-30 19:20:05,,False,5
1576,"I've been using BoS remote banking for years - since the old HOBS.  Over time, I've seen this iteration morph from something that was barely useable to what it seems to be today - a thoroughly useable application I would hate to be without. Easy and logical to use - other banks would do well to take a look at this app.",WilsonJO,Best version yet.,2016-10-21 05:18:14,,False,5
1577,This app is great!!! Banking on the move couldn't be easier only thing I cannot find is where the messages are? When you get an email from the bank saying you have a new message please go online and see your message (or words to that effect) I can never get to read it!!,Ohdala Cuz,Ideal,2016-06-04 20:16:24,,False,5
1578,"Reviewed previously, re-submitting to improve rating.  Great to see pending transactions included.  Would love to be able to see direct debit due dates.  Transactions list still starts repeating intermittently towards start of month.  Overall a great app and hope additional functionality continues to be delivered.",StalkerMaw,Continued Improvement,2015-07-14 15:53:54,,False,5
1579,This app is a massive improvement from the original one. The only criticism is that you can't see your mortgage statement on the mobile app. Also there has been a technical issue for some time now and the warning message is very vague. Maybe updates and an estimated time on when the app will be up and running again please.,Rossg87,Very good improvement,2015-09-01 07:30:49,,False,4
1580,"Everything I'd want from my banking app - easy to access but still secure, with all the functionality I need for making payments (including on that almost embarrassing day I forgot my wallet for dinner in a restaurant). Clear and user friendly. Keep it stable and safe and I'm happy!",Mrovich,"Excellent, stable and user friendly",2016-11-26 13:45:37,,False,5
1581,"Good all round app and very easy to use to check balance and transfer money or make payments, would prefer to be able to access standing orders and direct debits to make changes if needed or at least be able to flip to desktop site instead if having to start up computer, but would still recommend 😊",Kirsty s,Banking App,2014-09-07 13:42:37,,False,4
1582,"Everytime I look for an app I want it's never been developed. I always search again two weeks later, and for some reason it's always been published within those few weeks!
I'm pretty pleased that BOS finally created an app, but I agree that the log in system is still too fiddly for an app. I second the PIN idea, it would be much easier, and still very secure.",Kathryn McMullen,It's a start!,2011-12-27 01:58:38,,False,3
1583,"I can't believe it has taken this amount of time for the bank of Scotland to get an online banking app for the iPhone. Every other high street bank has had one available for over a year now. It's taken this amount of time for a very shabby app. Disappointed.

This app doesn't make it any easier than logging onto online banking over safari. It's has a very basic interface and logs you out if you navigate to the tabs at the bottom of the screen.",Sam 5 ,About time-Very basic,2011-12-21 14:43:50,,False,1
1584,Have to applaud Bank of Scotland for making this great app. It's easy to sign up for and you can manage your finances on the go. It's much easier than the website - especially as you can now you the iOS built in touch system for identity verification. Definitely download.,Master Of Ninja,Great easy to use banking app,2016-11-12 11:01:40,,False,5
1585,"Very reliable for payments and money comes off right away, easy to set up and pay contacts. Still occasionally freezes and doesn't work which is a bit of a down fall but works about 8/10 times.",RossWilson94,Easy to Use and works most the time,2015-07-31 10:23:58,,False,5
1586,"I really love this mobile banking app...it works so well, it's easy to use, everything is there at the touch of a button, it's up to date showing me every transaction, and it's quick!
My fiancé is with another bank and their app is miles behind. 
Thank you x",MissTong,Efficient and easy to use x,2016-02-04 21:36:13,,False,5
1587,"As the title says it does what it's suppose to do. It's not glamours but it doesn't need to be ethier. 
I would love to recommend that they follow suit with PayPal and add in the Touch ID feature for logging in to make everything easier and loving the fact that they have added Apple Pay use now ..... Eventually",Weemac5,It does what it's suppose to,2015-12-19 15:14:17,,False,5
1588,Excellent banking app and extremely easy to use... Makes it so much easier paying money into a business/personal bank account without the rigmarole of visiting the branch and standing in a queue to do something that takes only a few seconds on the BOS Online Banking App 😜,gordyboi86,Easiest Banking App Available,2015-06-18 23:25:23,,False,5
1589,"I had decided I was changing banks to one with a cash back offer. However, this app has become so good it's worth the £100 incentive not to change. Well done BoS, excellent app that does everything it should and far easier to use than on the website. Give yourself a pat on the back!",iDavidson2,Perfect,2017-01-22 23:51:02,,False,5
1590,I think this is a great app. Really makes day 2 day banking a breeze. I would love to have alerts for money in and money out which are above what your average sum is in case of fraud you could preset that amount in the app possibly. I would like to be able to have alerts if money is removed from outside the Uk.,Jinntyb,Jinntyb,2015-12-02 10:11:36,,False,5
1591,"There is so much more that could be done, make it more personal, tell me how much i've spent under 5pound in the last 24 hours, let me see my spending and my patterns and what i should do to change it if i want to save up more. Yeah it's easy to use but don't stop there. Just because you're a boring bank doesn't mean your app has to be boring. Technology is always improving guys, better keep up with it or you'll lose.",Bobbymisread,"So much room for improvement, get on it guys!",2016-10-31 12:30:48,,False,2
1592,"The BoS app is excellent. Secure login, extremely easy to use, account information is always up to date, and the facilities available are identical to those available on line. Making payments is so fast and easy it takes the stress out of worrying about missed bills. I'd recommend to any BoS customer!",Paul Orr,BoS Ap,2015-09-04 11:46:06,,False,5
1593,No more standing in line at the bank just to transfer money from one account to another. Really easy to use and saves a lot of time (like your lunch-break!!) having to go to the bank only for the people in front of you to take ages!!!!! Couldn't do without this.👍🏻,Delmonte72,Magic App,2016-06-18 19:15:08,,False,5
1594,"The app is very clear on displaying your account(s),  very easy in transferring money for payments along with giving you options on Paying Now & Paying Later.
Would definitely recommend this to any fellow customer, especially for those who rarely have time to make such transactions & need to check their balance.",JoSers27,Very Handy,2014-09-26 15:48:09,,False,4
1595,"This app is so useful to check your balances, transactions and income even when out and about. You can make transfers in a few simple steps and the money is there immediately, quite amazing really. I'm very new to online banking but because of this I am now a fan.",Caitlin🐘,Bank of Scotland banking app,2016-01-04 12:43:30,,False,5
1596,"This is a really good app, and I don't have to repeat all the positive feedback others have given already. Unfortunately, I regularly encounter the ""black screen issue"" mentioned by some reviewers, too. It means I have to restart my phone on a regular basis in order to launch the app successfully. Once I have done that once, a new log-in attempt will result in the black screen. Please get this sorted!",railwaymodeller,Fantastic - when it works...,2014-12-02 15:43:52,,False,3
1597,"The app is really good great for keeping up to dye with balances on the go and transferring money. The only thing missing is the ability to view pending credit/debit card payments to do this I have to use my browser and change to desktop view, if this was available in the app it would get 5 stars",Largolgal,Good but could be better,2014-08-29 07:12:54,,False,4
1598,This app is very straightforward to use. It has never caused me any problems. I use it at home and out and about on my iPhone and iPad. It has improved since the last upgrade and I rarely have to log in to the Internet site now as I can do most of what I need on the app.,Mojito77,Simple and convenient,2014-11-27 19:22:37,,False,5
1599,"I find this app invaluable in checking up on accounts and transferring money either to pay bills, people or between accounts. Much quicker and easier than the website and works well on the go. I never have to go into the bank in person as this app is so quick and convenient.",HezzaP,Does what I need it to!!,2015-04-27 15:14:54,,False,4
