,review,userName,title,date,developerResponse,isEdited,rating
0,"The app does not allow you to move a direct debit from one Bank  of Scot account to another  in the same account holders name Telephone  banking doesn’t allow it either. You need to go to a branch and very few staff work in branch meaning long waits.
I discovered this when l could not do it online. Phoned the contact centre to get the most unhelpful person who spent one hour talking to me advising of all she couldn’t do. I had to go to a branch and after the wait the matter was sorted . The bank provides contradictory’s advice. Contact centre advises it’s the customers job to contact the company to be paid by direct debit however the branch can transfer a DD from one account to another.
Online banking cannot do this.
Let’s look at this please and bear in mind Customer Service is important 
ONE hour into a contact centre to be provided with no assistance is unacceptable",Darcydog1234,Good but always ways to improve,2019-10-20 10:19:42,"{'id': 24554317, 'body': ""Thank you for your review, we were pleased to hear you go the issues with your online banking sorted out following your visit to branch. Since you left this review in 2019, we've made a lot of improvements to our app. We'd love to know what you think. ~ Emma"", 'modified': '2021-08-17T10:50:01Z'}",False,5
1,"All I want is to be able to come on the app and see plainly my accounts and their balances.

Instead all you log on and see is a messy interface with ads, irrelevant information modules I don’t need or want to see and buttons all over the place. It’s a mess. I just want it to be simple. Log in, see my accounts on the page with no ads or boxes separating them unnecessarily. If you want to give information out them on a separate page cause the extra ad boxes and icons just make your homepage look a confusing mess of an interface. It’s just not needed. Neither are the new “quick buttons” or whatever they are that now show under each account. They just clutter the page and make it look messy. They aren’t needed, these options were easily accessed in the regular way prior.

It’s funny that this is not shown on your App Store screenshots either. THIS is what I want, what you advertise it looking like on the App Store, but that’s not what it looks like in real life, it looks like that with boxes and ads in between all your accounts with no way of turning this off or opting out.",danny_c,Messy interface,2020-05-19 21:56:23,"{'id': 24554303, 'body': ""Thank you for your review. We work hard to ensure that our app is simple and easy to use.  We'll be sure to pass your improvement suggestions to our development teams. ~ Emma\r"", 'modified': '2021-08-17T10:49:08Z'}",False,2
2,"Your Private Banking service has caused me to believe that customers with substantial sums at the bank are neglected and overlooked.
I have this impression after years of loyalty with BoS.
Other banks are so much more customer focussed, looking at ways of assisting in increasing wealth and security. I have only ever experienced BoS as a bank of self-interest. Nobody has even asked what I would want to do with the millions lying practically dormant in a deposit account.
My recent experience of communication, especially with regarding to a recent major bank account fraud has left me wondering where I should transfer all my funds as the security procedures in the bank are not as solid as advertised and you are simply not interested in me as a private banking customer.",Aboomah,No contact,2019-11-08 15:50:29,,False,5
3,"Having received a message from a recipient to say that the payment I had sent had not been received, I looked on my app to see the payment hadn’t been recorded as sent.  If I had looked closer at that point, I would have noticed my balance had changed although payee not recorded.  I paid her again - still no record on the app.  I checked balance to see both payments had been debited.   I contacted the bank to be told that the app wouldn’t be updated until 1st July because it was the end of the month and the weekend 😱.   The transaction has not shown up in the payee’s account and her balance hasn’t changed.   I was advised to check my desktop.  I don’t have my account on the desktop and it is a busy Sunday morning.  
This app is not an improvement on the previous one and I am left to ponder where in the ether my double payment is - left my account, not in the payee’s account, although both times I was informed payment was successful and would appear in the recipient’s account immediately.",Mabivy,Updates are antiquated,2019-06-30 06:50:51,"{'id': 24554308, 'body': ""Thank you for getting in touch, and we hope that this transaction issue was resolved for you.  Since you left this review in 2019, we've made a lot of improvements to our app. We'd love to know what you think. ~ Emma\r"", 'modified': '2021-08-17T10:49:25Z'}",False,2
4,"Don’t even attempt to call them to help or explain why you can not transfer YOUR money. Apparently it’s a bug but zero explanation or time given for a fix! Only exasperated by the fact it’s week three and my new card still hasn’t arrived nor was it ordered three weeks ago AGAIN don’t expect an explanation or a reason because Bank of Scotland apparently don’t provide reasons, just a poor banking service. However, the rude call handler will transfer your money for you, it only takes 11 minutes and you get the pleasure of speaking to someone with a bad attitude and complete lack of social skills but hey you also get to be reminded repeatedly that you can also just log on using a PC. Hello 2018",MILLENNIALWITHOUTACARD,Poor app. Poor service.,2018-10-24 19:21:42,"{'id': 24554326, 'body': ""Thank you for your review, and we were sorry to hear about the concerns  you had in 2018.  We have made a lot of improvement to our app since that time, and we'd love to know what you think. ~ Emma"", 'modified': '2021-08-17T10:50:44Z'}",False,5
5,"It’s crazy that, in this day and age, to utilise the app for paying off your credit card you have to open a bank of Scotland current account. I already have 3 current accounts - I don’t need another one just to appease bos! So as a result I’m in unable to pay off any of my credit card balance without logging in and paying through the website. And for someone that clears off balances whenever I have free funds ad-hoc (not a specific regular direct debit which is the only option for me) is incredibly inconvenient. Very poor. 

Please allow debit card payments to pay off credit card balances in-app! Barclaycard’s app was FAR more user friendly than this app which is basically just a balance checker unless you also take out their current account, pay into that from your main current account THEN pay the credit card balance from in the app! Bonkers system. Sort it out. At this stage i regret the move from Barclaycard MASSIVELY.",Paul-d-88,Support for non BOS payments,2018-12-28 09:52:58,"{'id': 6616295, 'body': 'Hi, thanks for leaving us a review. We are always looking at ways to improve the App and your feedback is appreciated. Simon', 'modified': '2018-12-31T11:07:39Z'}",False,1
6,"This most recent iteration of the B of S app. shows continued innovative efficient development, delivering a tool that is a pleasure to use and appears to be at the cutting edge of the modern technology, and to me, so way ahead of the other banks that I use.
A high level of common sense has been brought to bear to deliver security you can trust, whilst keeping it at a minimal and simple to use level.
With other competitors I find that, in their efforts to demonstrate high security, the process has become confusing, laborious and time wasting!
Congratulations to B of S, whom I am proud to have stuck with, through thick and thin, since I joined at the age of 19, when I first went to Dundee University, in October 1972!",ernestpiper,Bank of Scotland banking App.,2019-08-14 15:34:54,"{'id': 24554334, 'body': ""Thank you for your review!  We were pleased to hear that you are proud to bank with us.  We've made a lot more improvements to our app since you left this review in 2019, we'd love to know what you think. ~ Emma"", 'modified': '2021-08-17T10:51:10Z'}",False,5
7,"Ok, hopefully now I have your attention developers? I added 2 other credit card accounts to this app 3 months ago (so that I can view those balances without moving out of 1 app to open another..a really good idea and USP by the way) all worked well until the 3 month re- authorisation rolled around a few weeks ago. I reauthorised my MBNA credit card account with no problems, ie: click the link in BOS app to open MBNA app to confirm authorisation then get taken back to BOS app... seamless, quick and secure. When I tried the same with my Barclaycard though.... oops! Instead of being redirected back to my BOS app my Halifax banking app gets opened automatically instead (and obviously the request to add Barclaycard to my open banking is never actioned)! I realise this may be a Barclaycard app issue but as the initial request originated from the BOS app then I guess it’s down to you to solve.",Mickeylick,Open banking module seems insecure,2020-05-06 18:53:22,"{'id': 24554346, 'body': ""Thank you for getting in touch, and we hope that this  issue has since been resolved for you.  Since you left this review in 2020, we've made a lot of improvements to our app. We'd love to know what you think. ~ Emma\r"", 'modified': '2021-08-17T10:51:53Z'}",False,1
8,"I find this app on my large screen iPhone is better and easier than using my PC, whether it’s checking transactions, making payments or managing standing orders and direct debits. (I use a PC double boot system on the PC so banking is done on a dedicated operating system rather than sharing with risky internet browsing - a safer and necessary ‘faff’.) The app is clear and functional, ideal for parallel viewing of account details and my own finance spreadsheets at the same time. The occasional need to check an account while out and about is easy using the selective password system and 4G (not someone else’s Wi-Fi, I hasten to add).",Bhuddabean,Happy Happy!,2018-03-17 14:03:56,"{'id': 24554343, 'body': ""Thank you for your review!  We were pleased to hear that our app has made banking easier for you.  We've continued to make improvements to our app since you left this review in 2018, we'd love to know what you think. ~ Emma\r"", 'modified': '2021-08-17T10:51:36Z'}",False,5
9,"BoS app is best internet bank app I have used so far. Very good as it allows account view, transfers, set up & manage standing orders plus quite a few features not on my other bank apps. Able to see upcoming payments too. Update to send notifications when transactions made in or out of account is a good addition. After a new account set up was able to see it after using the 'New +' button in My accounts. Most things are intuitive but some changes take me a bit of time to adjust to.",The mck,BoS bank app is good,2022-02-10 10:53:44,,False,5
10,"Do not even bother to download & try to use this app as it is useless. You cannot print directly from it as you could from the previous BoS app unless you go to the bother of creating a separate pdf file each time you want to print your up to date income and expenditure. You cannot see two separate columns showing incomings and outgoings as you could on the previous app, but instead there is just one column which has plus and minus signs beside each amount. Useless for anyone. The Bank of Scotland should be ashamed to have produced this. It is a backward step.
When I complained to the BoS about its shortcomings I was told to log in to my account via a web browser, so what exactly is the point of this app?",McTavish501,Useless app,2019-09-28 09:30:42,,False,3
11,"I haven’t been able to even get onto the app! So I can’t actually write a review on the app itself but getting set up I’ve had the worst experience. I set it up like normal and had my memorable information sorted and everything but when I was asked to log in after setting up it asked for the 7th letter of my memorable info when my memorable Information was a 6 lettered word. So I changed it over the phone, once tried again didn’t work. Changed it again over the phone twice this time deleting the app then downloading it again and it still didn’t work so I tried phoning up customer service and was left on hold for two hours so I gave up and tried a third time and now I’m locked out the account and despite me phoning up to get locked out like it told me to. That didn’t work either.",Gxminix,Terrible service,2019-01-26 14:10:48,"{'id': 7065208, 'body': ""Hi, sorry to hear you are having an issue with the app. Are you able to log into the secure area of our main banking website with your details? You may need to speak to one of the team to get your profile unlocked first. If once you've logged into the site but still can't log into the App could drop an email to mobileapps@lloydsbanking.com so we can investigate this? If you could include what you have and not been able to do, this will be a great help. Simon."", 'modified': '2019-01-29T13:29:29Z'}",False,1
12,"Very irritating indeed . I was locked out of the App as the fingerprint unlock on my iPad was legitimately changed to include my Wife’s. As a precaution ( wisely ) it locked me out . My “ memorable information”  is lost in the dim and distant , and so when I try to change the “ memorable information, it will not recognise my first character in the confirmation of my change, and hence the memorable information does not match. Tried this five times in succession. Is this deliberate. Bank of Scotland take away our local branches , and give us Apps that don’t work as a sop.",Borva Boy,Very Irritating,2020-10-05 06:34:48,,False,5
13,"I found this app to be absolutely invaluable, my daughter helped me initially set this up but just 2 clicks and you’re there absolutely wonderful no more forgetting cards in stores ec cetera no longer searching the house after I do an online with my card then can’t find it the next again day!! I’m sure the bank would help people set it up on an app but if you have an Apple IPHONE like I do, then goTo a local Apple Store near you and there are lessons on how to do it yourself, I hope this helps💫",Betty Edits,Brain Injured Person,2021-08-12 16:35:37,"{'id': 24871367, 'body': ""Hi, and thanks for your review. We are pleased you find our app so helpful. And you're right, we want to help our customers feel confident using online services - that's why we provide lots of helpful information and lessons to build digital skills through the Bank of Scotland Academy. Full details of this provision can be found through our website, or by visiting www.bankofscotland.co.uk/aboutonline  ~ Emma"", 'modified': '2021-09-02T12:47:32Z'}",False,5
14,"This app is very good and very helpful. The reason I'm refraining from giving 5* is that I have had a lot of issues with requesting a change of address and/or a change of PIN. For some reason, the registered address of a savings account is stored separately from the registered address of a credit card that is tied to the same account (god knows why BoS does it this way). For a very long time, the app just used to give me an error when I was submitting such request and the only way was to call (long wait on the phone but that's a different matter). I finally got the right address in through the phone.",Panosroussos1,Very good overall,2018-01-30 11:27:08,"{'id': 2455930, 'body': 'Thanks for the feedback and apologies for any inconvenience. Anthony.', 'modified': '2018-01-31T10:24:24Z'}",False,4
15,"The app is fine and works pretty well but I always got annoyed that the displayed amount that I have in my account never took off the money in my pending transactions, always leaving me thinking I had more money than I did. I could look at the available section and do a bit of maths in my head to work out how much I had and how much was my overdraft but it was annoying and I could never work out a reason for it being like this. Then the other day I was delighted to see they had updated the app to automatically take the pending transactions out of the amount, only for them then to go back to the old way the next day? Why?!",chowie123,Made better then made worse?,2019-11-17 00:53:04,,False,3
16,"With the old App, now discontinued, I was able to regularly check details of investments which had been recommended to me by HBOS financial advisers. With the new App, this information is not now available because the Bank in which I hold the investments is not listed. The new App has effectively reduced the level of service provided. While other functions of the new App are the same as with the old, as an online customer, I consider I am now less well served. It certainly doesn’t feel like an improvement to me.",Handy Dave,Accessing Investment details,2019-08-27 22:24:15,,False,5
17,"I use online banking all the time and this brings it to a whole new level. I have an iphone 7. An excellent app with which I've found no issues. It's quick, extremely easy and really brings your banking to your fingertips. Security seems spot on too, with all steps taken for the users protection. New fingerprint security makes it all the sweeter to use. Don't hesitate to use this great wee tool. You won't regret it.  I see some reviews saying it doesn't work. Nonsense!!!",Scotsgirl46,Excellent app at your fingertips!,2017-09-30 07:21:56,,False,5
18,"This app works well enough for day to day actions, transfers, and checking accounts. However nestled between your accounts there is constantly adverts show... ‘bank of Scotland is secure’ and offers for overdrafts and more accounts. I’m already a BoS customer, I don’t care about these... I’m already a customer. I know who to ask for more service, which I can do as and when I need them. They get frustrating.
Accounts can be renamed, however not via the app which isn’t the end of the world, you do this once. The account names do show in the app. Supports face recognition unlock, and you can see your statements.",stalky14,Adverts everywhere!!,2019-08-24 11:13:37,,False,3
19,"The BoS app is very easy to use and easy to navigate around the different functions. 
I like the dashboard at the top of home page where you can easily slide between your different accounts. I also like the money available information being presented so you don’t have to deduct your pending payments from shown balance.
I have give this app 4 stars as I quite often receive the message saying the app is experiencing technical problems which can be frustrating when I want to make a transfer whilst it’s fresh in my head.",lmcn86,Easy to use,2018-06-24 08:48:37,"{'id': 24554350, 'body': ""Thank you for your review!  We were pleased to hear that you find our app easy to use.  We've continued to make improvements to our app since you left this review in 2018, we'd love to know what you think. ~ Emma"", 'modified': '2021-08-17T10:52:08Z'}",False,4
20,"BOS banking app is a great app but why can’t I have fingerprint login on my iPad Pro like I can on my iPhone. I’ve been asking this for around 2yrs now either by email or letter, what ever that is, and have not had a single reply so I’m not expecting one here either!! It must be simple enough if I can even use face recognition on my iPhone Xs Max now. The BOS is the only bank app I can’t use fingerprint authentication on my iPad Pro. The other banking apps I use have it so why is BOS so far behind (at least 2yrs) the competition?",GazEllins,Best banking app going,2018-10-02 05:41:59,,False,5
21,We have only been customers with the bank since the end of November this year. I have been unable to use my card online. My husband has no problem!! I have used my card to withdraw cash & contactless. Bearing in mind the time of year & a family to buy for be it food or Xmas presents I am frustrated & annoyed. Have tried contact the bank by phone. Just yesterday I spent 18 minutes waiting on the phone & when I finally got through I was told she couldn’t help me & transferred me to another department which I then spent another ONE HOUR before hanging up!!! All chat on the website was no help either only advising me to call the help line!!!!! VERY DISAPPOINTED customer.,Suzimonks,Customer Service,2020-12-13 14:38:01,,False,1
22,"Have Banked with them since 1962 with a small break when I worked in Canada I can understand why they are shutting branches l find on line banking very convenient if I do have a problem your 24hr phone banking is very helpfull I have even used it from New Zealand I got the problem sorted out in 5min
I also find the local branch very helpfull the service I have received now is far better than it was 25 years ago.
          Regards,
         Donald Wemyss  ( age 75)",portobello man,Donald wemyss,2020-10-08 06:19:48,,False,5
23,Love how easy it is to create new transfers and move money about between accounts. As it’s the app it fits perfectly on the screen and works much better than using just a browser online. If you leave it for a second it automatically logs you out so you know even if your phone was stolen you would still be safe. You can also put it to log in with your fingerprint and that works really quickly.,Shiv45894839302,Quick and easy,2018-06-16 18:23:11,,False,5
24,"This is a magnificent app by Bank of Scotland.  I use it daily on my iPad or iPhone to keep track of my bank account and credit card balances, without the hassle of logging on to a desktop or laptop.  You can check balances, pay bills, move money, create new payees, delete direct debits and virtually everything else you would do via a desktop computer, all whilst on the go, if you fancy.  It's easy to log in too, yet appears very secure.  I can't fault the app at all and would thoroughly recommend it..",999tommo,Superb Facilities,2017-07-26 09:40:24,,False,4
25,I haven’t been able to amend my overdraft. Not because it’s declined but when using the app and filling out the details required it then comes up saying that to finalise the request I have to call bank of Scotland. Calling them takes forever and when I phoned to query why the application was not being processed on the app I was given very little help and a dismissive attitude. The service of an overdraft and the ease to control the amount both up and down is a great freedom I have enjoyed over the years and now with it not working and a dismissive service on the phone I am very frustrating. To call them and amend your overdraft takes about 25-30 mins as opposed to 2mins on the app.,MochiMatt,Service is no good,2018-06-10 17:28:53,,False,1
26,Having banked with B of S for 50 years this is the first time I haven’t been able to successfully move forward with new technology. Over 2 days I tried at least 16 times to change from the previous app which I have had no problems with. Niall in the call centre was extremely helpful but still I couldn’t access my accounts! I am going abroad on holiday in 3 days so this was a very inconvenient time for problems. I hope if I call in personally at my branch tomorrow they will be able to assist.,Specs appeal,4 hours !!,2019-08-26 23:16:43,,False,4
27,"I have been using the Halifax app for a while but got a new phone recently and updated my bank of Scotland app to use that. Since then, only a a few weeks ago, there have been several occasions when I haven’t been able to access the app with a variety of messages being shown ‘technical difficulties’ being the most frequent. Although at times the Halifax app has had the same error at the same time I have been able to access this on occasions where I couldn’t access BOS app",MR14 SMV,Glitches in App?,2022-01-27 22:39:47,,False,3
28,"Only recently, did I become aware that not all banks have this quality of service! Totally took it for granted until I tried to help someone with their online banking. It couldn’t do half the things that are so easily done with Bank of Scotland. Pay in checks, transfer money, checking accounts. All really easy. And I’m not very techie. It’s easy to set up and functionality is the best!",Dad Against Climate Change,Excellent service,2021-06-10 12:45:29,,False,5
29,"Love my banking with BOS, however, there seems to be a trust issue from you guys....my account has never been in the ‘red’ in all the years I have been a Customer. I’ve also in the past had a now completely paid off mortgage with you, so when I called to ask if I could arrange a short term overdraft, only to be told after all of my information was given, that it wasn’t possible as my address was in Spain......",#letmein,Review,2019-11-05 13:38:59,,False,5
30,"So this app is easy
To access, let’s you keep on top of your finances , let’s you transfer money or pay someone. Well it does, when it works and it doesn’t work a lot of the time. Getting fed up with the uselessness of this app and am seriously considering moving to Virgin. Their app works very well, does what it’s supposed to, gives advance warnings if it’s going to be offline in other words completely the opposite of BOS. I have tried unsuccessfully all day to pay my visa bill. Come on BOS. get this right.",Hopefully Hoppy,Could be better,2021-04-01 17:10:57,,False,3
