,review,userName,title,date,developerResponse,isEdited,rating
348,"Great user friendly app to use.
I especially like the pay cheques in feature, Saves visiting a branch especially while Covid 19 is going on.",STUROB68,StuRoberton,2020-10-12 12:12:53,,False,5
349,"Love BOS and the new app is just fab.
I feel safer as you keep me in touch with every transaction so I know upto the minute information on my account - thank you!",M80312,Just perfect,2020-06-13 13:00:52,,False,5
350,"I wish the limit was higher for paying cheques,otherwise far better than RBS 😀😀",Ronnie 12346,Paying in cheques,2020-03-24 07:19:44,,False,5
351,I do not know why anyone would think that this was straightforward. I wish we were back to the old method of banking - why change something that works!!?? Fuming oldie,Fuming oldie,App,2019-10-15 21:03:59,,False,5
352,"Makes transferring cash and paying bills so simple no need to call into a branch, as you can manage your transactions 24/7, it’s as easy as that, if I can do it anyone can do it 👍",Shaunkyle,BOS App,2019-10-06 12:16:45,,False,5
353,I love the online banking app. It makes it so easy to move my money about. I also love the notifications as they help warn me when I am going into overdraft or worse.,tamthew,Happy banking,2019-09-30 19:10:31,,False,5
354,"Very useful app. You can do your day to day banking, plus transfer money abroad, check on other accounts. Very simple to use.",Occasional scanner,All your day to day banking needs,2019-07-06 07:04:20,,False,5
355,"Love this app, it lets me look at my account anytime I wish too, do transfers at the press of a button as well as keeping track of my money",Joeblogs54,Easy to use,2018-08-07 16:24:07,"{'id': 5038307, 'body': ""Hi, thanks for leaving us a review. We're glad to hear you like the app. Simon."", 'modified': '2018-09-13T16:06:12Z'}",False,5
356,"I only use the app for my credit card as I bank elsewhere and I have to say that the new app looks quite basic when compared with the old one.  

Seems to give a little less info when you click on a transaction for more info.  To me it isn’t as user friendly or nice to look at.  I wonder what the reason is for discontinuing the old app.",Vixcne,Doesn’t look great,2019-06-08 14:44:17,,False,1
357,Didn't want to download this as I am 60 and well.... so glad I did. Makes banking so much quicker and easier but I still feel my accounts are safe.,Sheenboyo,Fantastic.,2018-02-13 18:40:02,"{'id': 2601381, 'body': 'Thanks for the feedback!', 'modified': '2018-02-16T14:41:13Z'}",False,5
358,"Easy to use, never an issue loggin on and lots of great features like card freeze; no gambling,
Etc. Would recommend.",StarWarsM,Great App,2022-01-28 09:20:01,,False,5
359,"1 year ago the app was fast authenticating and in the menus inside the app, now is slow until the fingerprint ID appears and slow to enter the app, the last updates didn’t help in this issue.",Xabanuuu,Slow,2017-10-05 08:31:23,,False,4
360,Excellent app getting better all the time Could do with more tracking details on out of UK payments like names not only reference number Great app.,hollytwo,BOS app,2021-11-18 10:35:37,,False,5
361,"I Find it very easy to get around on the 
B of Scotland website and glad I made the shift. 4 stars because too early into the account without further experience. 

Donald",cumbrae05,New bank,2022-01-21 17:23:25,,False,4
362,"I love having the app on my iPad, as If I have forgotten to take phone to bedroom,   I know my iPad is there so I can see what I have left in my accounts",Smithie@53,Easy,2021-09-03 13:03:13,,False,5
363,This is the best banking app for everything also paying in checks over the phone,davidshot,Best bank ever,2021-04-28 08:28:05,,False,5
364,Efficient and easy to use. Easy to transfer money between accounts,Mhannewyle,Review,2020-11-27 10:30:31,,False,5
365,I was happy the way your banking worked I totally hate this new app . Turn it back please,Janicebla,Disappointed can’t put in a company name to find a list of payments,2020-01-03 11:59:44,,False,5
366,Loving the way pending transactions taken off account immediately or at least you know an accurate balance . Well done Bank of Scotland. Great idea . Thank you so much x,ambandrob,Review,2019-12-23 18:37:20,,False,5
367,Recent convert to Bank of Scotland App. Functionality much better than my RBS account. Easier access and navigation across accounts. Excellent.,UncleAlbert05,Great Functionality,2018-12-16 09:26:52,,False,5
368,"This new app supposedly designed for iPad is a step backwards 
There is no option to view investments, you have to navigate via a menu bar to accomplish anything while previously it was all there in front of you.
Also the app display is nothing like the advertised display on the download page, it only fills the centre of the screen.
Absolute waste of time.",Glesgaguy,Terrible update,2019-06-07 08:35:15,,False,1
369,So easy to use with everything you need within the app.  I always look forward to new updates. Well done to the developing team.,Ryz23,Great.,2018-05-17 05:10:48,"{'id': 3504932, 'body': 'Thanks for the great review', 'modified': '2018-05-17T18:00:48Z'}",False,5
370,"Brilliant app but needs updating for iPhone X, I’ve tried logging into my app on my iPhone X on multiple occasions but it keeps telling me there was a fault and I shut try again later.",25214941,Great app,2017-12-20 20:39:18,,False,5
371,"V good system. Slick and user friendly,well done. It has become an essential part of my life. I love the instant notification of transactions.",sydney bridge,System,2022-01-26 21:17:58,,False,5
372,This Bank is the best in Scotland and it a home bank who will never let scammers have access to steal your money. Bank of Scotland Best Bank from the The SCOTTISH….. no size,ekow graham,Best Bank among the Rest,2021-12-18 21:22:49,,False,5
373,"Couldn’t do without this online service.
Great.  Check account every day.  No banks left up here.
Thanks",disappointed with EE,Review on online banking,2021-12-04 19:38:05,,False,5
374,Easy banking,snaterblog,Better site than my previous bank and more branches,2021-07-12 10:13:39,,False,5
375,"It is as simple as 1-2-3. Very easy to use any where in the world.
I would recommend it to everyone.",Eastbourne1986,Mobile banking,2020-12-13 11:56:06,,False,5
376,Great facility but a bit of a faf  if you don’t have all the security when using the system,seveerg,Transfer,2020-04-13 14:52:04,,False,5
377,"Constant crashing especially difficult when it crashes mistranslation without me knowing if it has been completed or not 
Crashed 14 times trying to cancel a lost card ended up phoning much quicker than trying to use the app",heather963,Crashing,2020-10-18 08:45:58,,False,2
378,I love using this app! I feel everything is safe and secure but so easy to use and ultra quick. Simple to navigate around too.,docker9,Simple quick easy,2019-02-03 12:59:47,,False,5
379,Need to be able to do more on this app to save you having to call up or go into branch,Scottiebird,Great app but needs more functionality to be 5*,2018-07-09 15:49:54,,False,5
380,Hey. The app in itself is great but there is just to much on screen add and what not its to clogged. The log in is a bit of a farce. I also have a Rbs app it’s just so simple.   Can you make it more like that?,Hobbitx,To much.,2018-01-13 08:39:15,"{'id': 2316938, 'body': 'Thanks for the feedback', 'modified': '2018-01-16T14:33:59Z'}",False,5
381,"It’s quick, easy and convenient. The only thing I’ve not managed to work out is how to arrange my accounts in the order I want to see them. If you can add this function I’d give you 5 stars!?",Josee68,Almost perfect,2018-05-01 14:14:25,"{'id': 3324483, 'body': ""Thanks for your feedback and suggestion. I'll pass on your comments to our relevant teams!"", 'modified': '2018-05-02T07:46:06Z'}",False,4
382,"Love the bank of Scotland app! It’s so EASY to use, EASY to see instantly how your accounts are, EASY to xfer money, EASY to bank cheques and  EASY to check upcoming payments. 
Love it!",Mairi Bheag 2,Easy as pie,2021-06-02 15:41:35,,False,5
383,Amazing app - friendly interface and easy to navigate.,GGO..,Money transfer,2021-05-09 12:31:07,,False,5
384,I do not like that it doesn’t clearly state how much you have left to spend including the overdraft,CallieLola,New format,2020-02-23 20:43:17,,False,5
385,It’s difficult sometimes to know your balance when you have and planned overdraft and pending payments.,cw1993cw,Balance,2019-10-17 15:05:18,,False,5
386,Long standing customer who you don’t care about in any way shape or form. Must leave but never get around to it,allotmentnurse,Don’t care about customers,2019-08-07 22:08:11,,False,5
387,"great functions, I like this bank . I would recommend it to friends , with families as well. you get loads of features with its current account . 👍 thumbs up!!",SMnineteen,5 Stars 2 BOS,2019-02-12 09:40:37,,False,5
388,"Very happy with hbos online services. Easy to move between accounts, transfer money, find information.",kirsty1981han,Happy,2018-06-26 13:17:00,,False,5
389,Excellent app - able to access my account information and transfer money on the go. Great bank altogether which suits all my banking needs.,Moira L,Excellent,2018-06-24 10:18:53,,False,5
390,This app has changed my life and saved me money and I’ve only been using it for one week wish I done this years ago. ❤️,sexxyimmy,Bank of Scotland app,2018-06-14 21:39:45,,False,5
391,Works exactly as it should - really well! Love that I can call customer services through it and that confirms my identity for me. Ideal for getting through quickly!,WeeGill,Works great,2018-04-14 17:12:51,"{'id': 3135097, 'body': 'Thanks for the feedback', 'modified': '2018-04-15T12:55:14Z'}",False,5
392,This app both on the iPhone and iPad works a treat. So simple to use and I have had no trouble using it. The contact and atm finder sections are a nice added bonus.  Highly recommended!,PJCally,So simple,2018-01-24 16:55:59,,False,5
393,"Lovely app, easy and intuitive to use.  I've seen apps from other banks and they simply don't come close to the Bank of Scotland's.

Does exactly what it says on the tin.",VeryHandsomeGuy,"Great, intuitive app",2017-09-11 19:58:01,,False,5
394,Love online banking it saves me waiting in long queues since you have done away with lots of bank tillers and importantly shutting down banks in towns and villages,massive bob,Queue,2021-07-27 14:52:42,"{'id': 24219338, 'body': 'Thanks for your review!  Glad to hear you find online banking so useful ~ Emma', 'modified': '2021-07-30T13:03:44Z'}",False,5
395,"Have been impressed with the BoS app, better than other banking apps I’ve used.",moman uk,Solid user experience,2020-12-21 07:30:31,,False,5
396,"You’ve got a great service here, Makes a huge impression and has great benefit to our lives thank you",Mr.Success.scot,Feedback,2020-10-03 10:25:45,,False,5
397,Finding this App on my phone so much easier and I can keep control of my money and make transactions without relying on my wife.,Mike Omark Oregon,Mikes view,2019-10-25 12:28:30,,False,5
398,The latest update for the app is terrible. I am a long time user and have never had a problem before. The app no longer shows you your available balance. You have to subtract what money you have from any overdraft funds you might have and it’s very confusing. Bank of Scotland need to reassess the changes they have made,littlephotobug,Latest update,2019-11-15 14:42:18,,False,1
399,"Hands down the BoS app is fantastic.

I bank, have a loan, mortgage and credit card with bank of Scotland. The app centralises my finances and manage everything.

10/10 for me!",Pedro_1993,Great work 👌🏻,2019-09-30 21:11:38,,False,5
400,Don’t know why I put off getting app for so long - it’s so easy to use and simple to navigate around. Now all my banking is done via the app and I’m very happy with it.,grannyebc,Top rate,2019-07-05 10:24:13,,False,5
401,The older app was much easier to navigate and it was more straightforward. I dislike this new one.,Cuba's mum,Why change,2019-07-03 15:30:02,,False,5
402,I have recently moved from Edinburgh to East Lothian and have been impressed by the ease with which I have been able to manage my affairs on line.,Professr John,Good distance access,2019-01-11 17:22:15,,False,5
403,A very simple and straightforward way to bank online. Having used other UK banking apps I definitely consider this to be the best.,No-smokes,"Does exactly what it should, with ease!",2018-10-26 17:22:41,"{'id': 5938765, 'body': ""Hi, thanks for leaving us a review. We're glad to hear you like the app. Simon."", 'modified': '2018-11-14T09:26:17Z'}",False,5
404,I love this app better than other banking apps I have had. It lets me see my pending transaction and it is easy to set up saving accounts x,CourtzH20,Pending Transactions,2018-10-22 05:39:07,"{'id': 5644499, 'body': ""Hi, thanks for leaving us a review. We're glad to hear you like the app. Simon."", 'modified': '2018-10-24T11:58:55Z'}",False,5
405,I’m very happy with BOS online banking and the App. My one request would be a tie up with one of the home book- keeping apps so I could transfer my statement directly to this,crhtScotland,Review,2018-08-30 12:58:24,"{'id': 5038326, 'body': ""Hi, thanks for leaving us a review. We're glad to hear you like the app. We are always looking at ways to improve the App and your feedback is appreciated. Simon"", 'modified': '2018-09-13T16:08:44Z'}",False,5
406,"Superb, easy to get help from family if unwell by transferring money & it is added to accounts immediately, love it for my bills my shopping online due to being unwell.🌟🌟🌟🌟🌟",s weir,Excellent,2018-06-30 06:53:39,,False,5
407,Great app. Can see your your accounts and transactions. Make payments and check and set up standing orders. Check direct debits. Secure as well with Touch ID and phone confirmations to.,Jnksgb,Excellent,2017-11-24 20:11:08,"{'id': 1854761, 'body': ""Glad to hear you're enjoying all the functionality in the app. Thanks for the feedback!"", 'modified': '2017-11-27T08:52:44Z'}",False,5
408,Never had any concerns using this app. It's clear and simple to use. The updated version even better than the previous,Dogs and bones,"Easy as 1,2,3",2017-09-18 16:54:20,,False,5
409,I find my Bank of Scotland accounts safe and easy to use thankyou,Treble 100,Safe easy to use accounts,2021-04-14 07:52:12,,False,5
410,"I use this app on my iPhone and iPad several times a week. It is reliable, secure and quick. I can logon with my thumbprint which is very convenient.",Black Bob 99,I like this app,2019-12-06 16:13:57,,False,5
411,Every update to this app makes the font size smaller and their is no we’re to make it bigger can’t see it when I’m out side even if I have the font size on my phone big should at least give us an option.,Cursedtoni,Not good for people visually impaired,2020-10-01 11:18:54,,False,2
412,"Only part of the Bank of Scotland is, that my branch a Garrowhill refuses to take large amounts on coins in a one time. And I find this very upsetting. As this is how I save up for my business car insurance.",08051968,Coins,2020-09-22 10:42:38,,False,4
413,I put in my password the first time it's 'valid' I then re-enter the password after doing that it says 'password secure' I press next and it says 'password is invalid' it was a 8-20 long password with 6 numbers and a fair share of capital letters aswell I'm looking at this app wondering should I have invested my money into this,Kyle Mcgrevy,Can anyone help or is this just the app??,2020-08-13 18:58:24,,False,1
414,Very useful app.  Keeps me updated and I can check at any moment for activity on my account. Easy to transfer money,Frosty121,Easy to use,2019-10-05 09:44:45,,False,5
415,"I cannot believe that the account holders, who do not use internet banking, will not change to this service",jaybell76,Internet Banking,2019-08-31 15:21:17,,False,5
416,Since the latest update this brilliant app no won't load so can't transfer funds not a happy bunny,Ranald white,Still crashes,2019-03-22 18:28:12,,False,5
417,Very easy aplikatiom fantastic opportunity for  old people because can usage any time live white any street about  new generation Oporto . I can tell any one about this aplikation .......!!!!!!!!!!!,grzeniu260,Very easy,2018-10-15 22:36:23,,False,5
418,The app is great. Really easy to use however I wish there was some way it could flag up when the account is close to using overdraft.,redaccie,Great app,2018-09-10 08:30:09,,False,5
419,Does everything you need it to do. Only problem is if you forget your password it’s hard to get back in,Robjob1234567890,Robbie,2017-11-05 16:40:11,,False,5
420,Easy to use but feels secure. Setting up standing orders or seeing when direct debits come off is very simple. The finger print makes it feel even more secure. Great app.,Crizz77,Easy,2017-09-29 17:05:40,,False,5
421,"I use this app everyday to keep up to date on my accounts, any updates are shown immediately. I would be lost without it.",Jacky65,Great App,2017-09-17 22:52:48,,False,5
422,Very easy to use. Been using for years. Highly recommend,Danismum,Bank app,2021-12-23 15:21:11,,False,5
423,I find this app extremely easy to use. Would definitely recommend.,EliieB2000,Very good app,2021-11-11 18:40:11,,False,5
424,I have been banking with the Bank of Scotland since I was a super squirrel saver 30 years ago !!! I will always bank with them as I trust them .,Weediva,Bank of Scotland,2019-12-17 23:00:36,,False,5
425,"Fantastic App, quick and easy to use. It has everything you need to manage your money. Love all the new features.",Carolyn66,Fantastic App,2019-10-18 08:57:28,,False,5
426,I just love my on line banking so quick and easy to use .as an older woman who is not very technical I manage this with very few problems just love it,mummy doc,Carol Docherty,2019-08-04 16:51:52,,False,5
427,"I love the convenience even though there are so many security measures, you’re still instantly accessing your accounts.",Possilam,Simplicity and instant.,2019-06-17 20:22:17,,False,5
428,The app is usually brilliant but it’s not showing any recent transactions when I go into it? And there’s no update to do on it? Should I reinstall?,Trollydolly 24,Recent transactions,2019-03-05 12:35:31,"{'id': 7694976, 'body': 'Hello, sorry to hear you are having problems with the app. Please can you check your app as this issue should be resolved now. Thanks. Chloe', 'modified': '2019-03-12T15:33:41Z'}",False,5
429,I love the app and I would never delete it but I can only get into my account while on WiFi even if I have 4G I can’t get on I was wondering if that could be fixed? But all in all an amazing app,MefwaPrincess,One issue,2019-06-15 08:49:06,,False,4
430,Allow you to change address and lot things can do well done,ZmajlSokoli,Excellent application,2018-12-06 19:20:03,,False,5
431,"This was a great app and so easy to use. But now it continually tells me I’m logged out, experiencing technical issues and try later (4865).",ohjoebadger,No longer working,2018-07-30 04:17:33,,False,5
432,"This is normally a stable app, but after the most recent update I have had repeated problems opening it while on mobile networks. The app is simply not loading and giving an unhelpful error message ‘App launch failed’. App is still fine on WiFi.",Jimmythehoover,Unstable on 4G after recent update,2018-11-06 06:22:49,"{'id': 5938850, 'body': ""Hi, thanks for getting in touch and sorry to hear you're having trouble using the app. Have you tried deleting the app and reinstalling the app and trying the app again? I'll pass on your comments to our teams can take a closer look. Simon."", 'modified': '2018-11-14T09:29:04Z'}",False,2
433,App so easy to use. Everything I need in one place to keep tabs on my account,lyn208,All I Need for Online Banking,2022-01-17 16:42:37,,False,5
434,This service is extremely quick very easy seemingly foolproof,wyldon,Internet Banking,2022-01-08 10:11:26,,False,5
435,Extremely easy to use now I have downloaded the app. I especially enjoy future payments function,Go BOS,Mr G,2021-10-27 15:49:59,,False,5
436,"No problems quick and easy, first class service.",Glenforsa,Excellent app,2021-09-14 09:39:27,,False,5
437,Very simple bank app some are too over complicated,marklaza,Easy to use,2021-09-08 09:12:50,,False,5
438,"Without this app I’d be forever in the bank, it’s so easy to use and very reliable",Ped69,Outstanding,2021-01-06 03:29:28,,False,5
439,Always excellent service and helpful advisers when you need them.,campixperson,Great bank.,2020-06-21 23:48:51,,False,5
440,Great simple quick online service,catluvstam,Online banking,2020-03-15 09:27:06,,False,5
441,The most powerful yet simple to use banking app on the planet. Friends who are with other banks are astonished at what I can do that they can’t.,Redrover55,Five stars isn’t enough,2019-10-11 12:28:52,,False,5
442,"Find this app for Bank of Scotland quick and easy to use 
Best way to keep up to date with your account",Snoop1957,Bank of Scotland Account,2019-10-01 18:45:42,,False,5
443,"New updates have made the app much more user friendly.
Have a couple of different banking apps and this is the best one by far",RC107,Great,2018-07-02 17:35:00,,False,5
444,Following the latest update one week ago I have lost the ability to use facial recognition to open the app. Do you have any suggestions? Thanks.,JFWH,Facial recognition not working,2019-03-23 14:49:31,,False,4
445,The Bank of Scotland app is easy to use with everything you need to keep track of and manage your day to day finances.,Rosebud 234,5 star,2018-01-24 21:08:24,,False,5
446,I love internet banking on it a few times a day makes me try and achieve saving cause can see what is going on,brimegs,Bank account,2018-01-06 17:30:26,"{'id': 2237246, 'body': 'Thanks for the feedback!', 'modified': '2018-01-08T12:31:44Z'}",False,5
447,Very useful app never have any problems using it. Quick and easy to manage my accounts. Well done bank of Scotland.,Gorebridge,Great app,2017-09-17 07:55:08,,False,5
448,"This app is very easy to use, brilliant for students. Managing money made easy. 100% would recommend this app.",Qervnjchn,100% would recommend this app,2017-09-09 17:56:44,,False,5
449,Much better than online website and Apple Pay and fingerprint scan is awesome,J.R423,10/10,2017-08-04 15:12:35,,False,5
450,With just a click of a button no hassle or fuss the job was done .,scottish mam,Great service what can I say,2022-01-06 14:40:38,,False,5
451,"Do you want to see and have total control of your money at the touch of a button, than this is the app for you.",tbernard,Brilliant App,2019-08-18 20:44:29,,False,5
452,The app once up and running is quite good but the setup process is poorly designed. The whole thing could be much better done via the web desktop app.,jimbo6543,Awkward to set up,2021-07-02 09:35:45,,False,3
453,I find the B of S internet banking service first class. I regularly use it and have never had any cause for complaint.,Wee Bobby T,First class app,2018-12-04 17:44:54,,False,5
454,Fantastic quick online service.  Makes my life that much easier.,msmulgrew,Online banking,2018-09-06 06:14:11,"{'id': 5038170, 'body': ""Hi, thanks for leaving us a review. We're glad to hear you like the app. Simon."", 'modified': '2018-09-13T15:53:53Z'}",False,5
455,Have had no problems or issues can use when I wish. So far great and easy to understand,diabs55,Excellent App,2017-12-01 13:28:46,"{'id': 1914985, 'body': 'Thanks for the review!', 'modified': '2017-12-04T08:56:19Z'}",False,5
456,"The app is good and easy to use, however there seems to be a problem when looking to get your settlement figure on your loan, it just brings up a page with a processing error and has been like this for over a week",Kevin Thomson180,Good app,2018-04-03 12:08:23,"{'id': 3135077, 'body': ""Thanks for the feedback, this is a known issue and we're currently working on a fix. Apologies for any inconvenience. Anthony."", 'modified': '2018-04-15T12:51:02Z'}",False,3
457,A really handy app to monitor and pay for things when on the go. Good for transferring money to others when unable to get to laptop.,Sauchie,Good App,2017-11-02 15:09:49,"{'id': 1811418, 'body': ""Thanks for the great feedback, good to hear you're using it on the go. Anthony."", 'modified': '2017-11-21T14:02:51Z'}",False,5
458,Text warnings about imminent overdraft only sent during weekdays are worse than useless,Plusfoursmax,Much improved with touch,2017-10-24 09:44:47,,False,5
459,The application has steadily improved and has simplified many of the actions. It is easy and quick to use.,Grin_wow,Works Well,2017-09-17 17:46:44,,False,5
460,"Outstanding! Top notch 👌
I'd be lost without this app and each month they give lucky customers a reward 👌👌👌
If You bank with BOS then You need this .",ILickBeans,Outstanding,2017-08-10 06:30:36,,False,5
461,First class service very straight forward,blaser270,Bank,2022-01-07 17:26:20,,False,5
462,Managing payments and keeping track of spending is really easy with this app!,techexpert-not!,Easy easy,2021-05-14 23:01:21,,False,5
463,I do enjoy using an app,gvdveuchrve,"Effective, reliable and user friendly service",2021-02-24 20:34:56,,False,5
464,"BoS app is easy to use, very handy and with a few steps you deal with payments, transfers, statements, etc. No fuss.",silversurfer12543,Straightforward and intuitive,2020-10-08 06:50:54,,False,5
465,BoA credit card wont allow online payments. We have to use another credit card providers to buy things online like car insurance for example.,(.)(.) :-),Online buying flaw,2021-02-06 15:48:14,,False,2
